source,text,rating,date,url
"playstore","Been using this for YEARS, it's pretty epic, cool and awesome but what a shame I don't have premium lol","5","2026-06-18T10:01:29.105Z","https://play.google.com/store/apps/details?id=com.spotify.music&reviewId=9e8e4b12-3e2c-49ae-aa62-51c48d6bc65a"
"playstore","best player in Pakistan","2","2026-06-18T09:55:58.702Z","https://play.google.com/store/apps/details?id=com.spotify.music&reviewId=7e2c089e-3326-4314-9786-a92b3bdd7dbd"
"playstore","when I lisen hanuman ji song single song after no one song available continue to hanuman bhajan amend it then we will give 5 star.","2","2026-06-18T09:52:45.213Z","https://play.google.com/store/apps/details?id=com.spotify.music&reviewId=f882c5ec-bd13-4b76-8f05-8fee3bb17e65"
"playstore","App works great, the Roku app has some problems opening cleanly and consistently which is a shame for how much I use it","4","2026-06-18T09:51:41.463Z","https://play.google.com/store/apps/details?id=com.spotify.music&reviewId=96b7510c-2c61-43cc-9903-367495822b8d"
"playstore","It's great trust me✨","5","2026-06-18T09:51:34.256Z","https://play.google.com/store/apps/details?id=com.spotify.music&reviewId=b9a6a545-c928-4383-b938-f21f212b350b"
"playstore","I can't hear any songs because it's premium but just for a month that's half my salary what is this app YT music is better. UNINSTALLED","1","2026-06-18T09:50:15.754Z","https://play.google.com/store/apps/details?id=com.spotify.music&reviewId=cead8d6f-3fc6-4eb6-8d33-e3a64c291049"
"playstore","We non premium listener hear plenty of ads, minutes at most, it's disruptive, repetetive, and annoying. Atleast make the selection of music unlimited it's the least you can do. If i discover other app that offers free music with free selection of music, I will replace this app with no hesitation. And of course you don't care even though you make a lot of money just us listening to the ads you make us listen","1","2026-06-18T09:50:02.916Z","https://play.google.com/store/apps/details?id=com.spotify.music&reviewId=d317e9bd-6cb8-429c-8530-c616cb34de9a"
"playstore","Got too expensive, used to be my daily driver but now I'm using apple music. Same service at a cheaper cost.","2","2026-06-18T09:44:52.220Z","https://play.google.com/store/apps/details?id=com.spotify.music&reviewId=ee22e009-1482-4d69-843d-302532062dc5"
"playstore","will steal ur money and not give u ur subscription","1","2026-06-18T09:37:52.154Z","https://play.google.com/store/apps/details?id=com.spotify.music&reviewId=691e82c2-bed9-4b44-be17-a31e956f0f6b"
"playstore","too many ads in between music 😞 ads kills the vibes 😔 too obsessed with this app","2","2026-06-18T09:35:47.436Z","https://play.google.com/store/apps/details?id=com.spotify.music&reviewId=b1c9a4de-610d-4384-bb39-64a065e0fd0c"
"playstore","all was asking primiem lisning very badddddddd👿👿👿👿","1","2026-06-18T09:35:46.251Z","https://play.google.com/store/apps/details?id=com.spotify.music&reviewId=91756b51-f833-439f-a351-b3d4bc611f35"
"playstore","not f2p friendly","1","2026-06-18T09:29:32.330Z","https://play.google.com/store/apps/details?id=com.spotify.music&reviewId=fede2e0c-0232-4b88-8204-ca0e92a6df43"
"playstore","they really want you to get premium and if not ur gonna be at a big disadvantage like not having songs play in ur playlist and insert they do similar songs","3","2026-06-18T09:28:10.287Z","https://play.google.com/store/apps/details?id=com.spotify.music&reviewId=b9b46690-a720-4c87-87ba-9602b819bc35"
"playstore","stop forcing new widgit","1","2026-06-18T09:27:28.299Z","https://play.google.com/store/apps/details?id=com.spotify.music&reviewId=2e728928-15d8-4f19-8fc0-eb30d6fde547"
"playstore","it's cool love the songs you added Spotify","4","2026-06-18T09:25:17.612Z","https://play.google.com/store/apps/details?id=com.spotify.music&reviewId=a39c463a-a053-44f8-a0d9-31b9461465e0"
"playstore","this app does not deserve one star","1","2026-06-18T09:25:01.465Z","https://play.google.com/store/apps/details?id=com.spotify.music&reviewId=4bb900f3-0d1f-4aae-856d-66fb7a5df751"
"playstore","I don't know what to say.. but If these ads come back again and again.. I will start downloading songs from other platforms","1","2026-06-18T09:24:34.410Z","https://play.google.com/store/apps/details?id=com.spotify.music&reviewId=0614d8ab-1eed-484b-9802-3e52fae45be6"
"playstore","Removed perfectly functional widget for one that doesn't work whatsoever. Don't waste your money.","1","2026-06-18T09:19:17.840Z","https://play.google.com/store/apps/details?id=com.spotify.music&reviewId=53b19489-bb45-4994-b0b1-900080134661"
"playstore","I LOVE THIS APP 😊😁❣️🤍","5","2026-06-18T09:15:55.319Z","https://play.google.com/store/apps/details?id=com.spotify.music&reviewId=3408b462-5215-43d9-b8be-701b94c0e55c"
"playstore","i lik I like it","5","2026-06-18T09:12:16.830Z","https://play.google.com/store/apps/details?id=com.spotify.music&reviewId=885b805e-6b46-4256-a78b-ac6c94e6ce19"
"playstore","Very disappointing experience. The app shows too many ads. When listening to songs, two ads play before the music starts and more ads appear after the song ends. It completely ruins the listening experience. Ads are understandable in a free version, but this amount of interruption is too much. Please reduce the number of ads and improve the user experience. 🤬😡😡😡","1","2026-06-18T09:08:53.896Z","https://play.google.com/store/apps/details?id=com.spotify.music&reviewId=a5a2dc1d-5792-4991-8ea6-6fa7a9d95817"
"playstore","As a Spotify premium user, I don't have much to complain about. But, the one thing that made me rate this 2-stars (hopefully, y'all need to take such feedback very seriously) is the ""shuffle"" algorithm. It is VERY DISAPPOINTING! I left Spotify for almost 2 years and recently decided to go back to it and this made me remember why I left the app. Having 206 songs in a playlist and Spotify ""shuffle-play"" decides, that playing the same 23 songs is a good thing ??😤 Y'ALL NEED TO DO BETTER!","2","2026-06-18T09:07:21.386Z","https://play.google.com/store/apps/details?id=com.spotify.music&reviewId=e9d4e4fd-8e60-494c-b7b2-7cb1f1c27d31"
"playstore","Best app of music","5","2026-06-18T09:03:25.359Z","https://play.google.com/store/apps/details?id=com.spotify.music&reviewId=e93d60c4-0120-4fd8-8a47-70d50c4a4bbb"
"playstore","it doesn't allow me to choose songs without premium and i cant skip a song this has to be fixed pls and thank u","1","2026-06-18T09:02:41.925Z","https://play.google.com/store/apps/details?id=com.spotify.music&reviewId=45dbfef1-50e3-471c-a007-0557a21f9c94"
"playstore","one of the best music platform","5","2026-06-18T09:01:55.578Z","https://play.google.com/store/apps/details?id=com.spotify.music&reviewId=4ae4a9df-7f4a-4885-9e60-3d9538e6c0f5"
"playstore","top music algorithm","5","2026-06-18T09:00:16.787Z","https://play.google.com/store/apps/details?id=com.spotify.music&reviewId=da77eb99-e9c1-4521-ba74-41c3aa76583d"
"playstore","It being trash, day by day,... Wort experience, spotify ❌ spotiadds ✅","1","2026-06-18T08:56:46.212Z","https://play.google.com/store/apps/details?id=com.spotify.music&reviewId=4c3102db-671f-46cd-b8c4-58f49eb3ae26"
"playstore","download becoming a premium 🙃🤮","1","2026-06-18T08:55:17.282Z","https://play.google.com/store/apps/details?id=com.spotify.music&reviewId=26860b71-81b1-481e-918c-850272f7161f"
"playstore","it's add is gross,specially if u trying to move from playlist to another","1","2026-06-18T08:52:50.722Z","https://play.google.com/store/apps/details?id=com.spotify.music&reviewId=2c902f04-7d9d-49d4-94f8-c888c38227e5"
"playstore","be for real, they need premium just to download a song? you can't even make re-tag the music, this update is piss me off, and they added many add, and they added something that you can play only one song. only one, and play tomorrow 😒. I suggest remove the limitations and adds.","1","2026-06-18T08:44:44.799Z","https://play.google.com/store/apps/details?id=com.spotify.music&reviewId=77434584-9707-4472-8481-7d14fac8db7c"
"playstore","The new update has ruined everything!","1","2026-06-18T08:43:00.350Z","https://play.google.com/store/apps/details?id=com.spotify.music&reviewId=61340d51-d75e-4544-9b1f-bb2e01e461cf"
"playstore","Good Songs of famous Singers","5","2026-06-18T08:39:22.386Z","https://play.google.com/store/apps/details?id=com.spotify.music&reviewId=9c7fa4f9-4e01-4a66-b607-f8b5ffbb7700"
"playstore","They are the best","5","2026-06-18T08:38:57.760Z","https://play.google.com/store/apps/details?id=com.spotify.music&reviewId=ee9c70cf-aa61-4f0d-a5fd-bdd1fd13bfce"
"playstore","all is ok except spotline vijay . not only me my friend also hate him","3","2026-06-18T08:37:02.900Z","https://play.google.com/store/apps/details?id=com.spotify.music&reviewId=15a06186-38aa-428f-9b17-59c0eecc64e3"
"playstore","Best of the best","5","2026-06-18T08:34:01.484Z","https://play.google.com/store/apps/details?id=com.spotify.music&reviewId=6998c5a3-742e-4901-8bcf-47568f0a541f"
"playstore","imma be real,THIS APP IS AMAZING THE ADS ARE LIKE 4 TIMES wich can be very onnaying BUT ITS SAVES SOME TIME!! if i go to the bathroom and the ads are playing,i wont have to press on the song! but sorry i wont buy premium( ´-｀) sooooo yeah all from me(^з^)-☆!","5","2026-06-18T08:25:54.800Z","https://play.google.com/store/apps/details?id=com.spotify.music&reviewId=13311b62-d14a-4673-ac38-8c96ab7c8434"
"playstore","best music app. only problem is ad","5","2026-06-18T08:22:35.870Z","https://play.google.com/store/apps/details?id=com.spotify.music&reviewId=35c47aee-da9c-4508-87c6-dcaef99b2cda"
"playstore","It makes me calm everytime when I opened this app, sometimes I listened to it before sleep","5","2026-06-18T08:20:32.642Z","https://play.google.com/store/apps/details?id=com.spotify.music&reviewId=126970ab-93ee-49ae-93b2-64e909b55f15"
"playstore","good just chose what song next","4","2026-06-18T08:20:22.909Z","https://play.google.com/store/apps/details?id=com.spotify.music&reviewId=74368e04-7f4c-42f6-bf11-07de45477828"
"playstore","good keep it on ❤️","5","2026-06-18T08:16:35.359Z","https://play.google.com/store/apps/details?id=com.spotify.music&reviewId=04031cf1-3e1c-4e4d-9ccb-c8cf4761ae2d"
"playstore","here are too many adand they ruin my mood and the vibe","3","2026-06-18T08:15:25.541Z","https://play.google.com/store/apps/details?id=com.spotify.music&reviewId=aaac818e-3e73-4e07-bc4b-e5edffdeb00f"
"playstore","its like average not good at all and can't be the best cz it's saying to get premium for like every single little thing and I hate that . The app is good but it would be better if they js stop saying to take premium for everything little thing. 😠","3","2026-06-18T08:14:22.159Z","https://play.google.com/store/apps/details?id=com.spotify.music&reviewId=077bbee2-202d-400c-9b04-3cd88eaf8799"
"playstore","I absolutely love Spotify, the offline Playlist that is made out of videos I haven't downloaded but can still listen to is absolutely the BEST!","5","2026-06-18T08:09:19.500Z","https://play.google.com/store/apps/details?id=com.spotify.music&reviewId=5bfad13b-77ca-4699-90fc-6e4f137f2bd2"
"playstore","it is a good music app but it have ads without premium but now the ad's system is improved and we do not get ads for 30 minutes","4","2026-06-18T08:08:58.799Z","https://play.google.com/store/apps/details?id=com.spotify.music&reviewId=13b42449-396f-4f2b-8869-db9e3c3fffe9"
"playstore","i get 3 ads per song thats insane","1","2026-06-18T08:07:06.373Z","https://play.google.com/store/apps/details?id=com.spotify.music&reviewId=64818523-68a5-454a-8fc5-e8e77c0ff739"
"playstore","too many advertisements, it's playing song after 4 advertisements, youtube is better than this.","2","2026-06-18T08:06:38.464Z","https://play.google.com/store/apps/details?id=com.spotify.music&reviewId=52a6bd34-d944-4ce2-9afa-f4d984a4f82c"
"playstore","best app for listening music 🎧 🎶 🎵 👌 🙌 😌","5","2026-06-18T08:05:52.355Z","https://play.google.com/store/apps/details?id=com.spotify.music&reviewId=67078e24-dbca-45e0-80d0-827178650d50"
"playstore","Switching soon. Getting rid of ""liked songs"" playlist was the breaking point. They keep changing to the ""improved"" UI, give people a choice as to what UI they want to use. Forcing me to use the glitchy garbage 4x2 widget instead of the 4x1 that worked fine was the last straw. Done paying for this garbage.","1","2026-06-18T08:05:47.873Z","https://play.google.com/store/apps/details?id=com.spotify.music&reviewId=f9d9848c-b89e-4f02-96f6-0a86effd6e62"
"playstore","too many ads and for every action premium needed","2","2026-06-18T08:02:26.444Z","https://play.google.com/store/apps/details?id=com.spotify.music&reviewId=90b0c848-0860-4cd6-a826-9e361142a570"
"playstore","love easy to find what you're looking for","5","2026-06-18T08:00:47.725Z","https://play.google.com/store/apps/details?id=com.spotify.music&reviewId=4d2e4a05-af09-46d7-af6f-b1ae6c04c871"
"playstore","just ads ads and ads","1","2026-06-18T07:50:47.840Z","https://play.google.com/store/apps/details?id=com.spotify.music&reviewId=dcd36824-1cb8-4479-9768-24dd5a6fc6ad"
"playstore","this app help me a lot when I'm in pain or lonely or bored 💖💖💖","5","2026-06-18T07:47:10.886Z","https://play.google.com/store/apps/details?id=com.spotify.music&reviewId=3b95e6f1-dd39-418e-80ca-9c727f94f62e"
"playstore","search karta hun kuchh aur hi a jata hai koi bhi download mat Karna jiska purana phone ho to bilkul hi mat karna","1","2026-06-18T07:46:39.852Z","https://play.google.com/store/apps/details?id=com.spotify.music&reviewId=1384f2bb-a0fb-417b-bb2b-83070af382ca"
"playstore","i like that but it have a problem that a playlist will not play in a sequence of songs in it","4","2026-06-18T07:46:02.747Z","https://play.google.com/store/apps/details?id=com.spotify.music&reviewId=77b0cb1b-af1a-476e-a29c-1d065f6b1fa5"
"playstore","It's easy to find what you want to listen to and there's a lot of great music on here. Would definitely recommend.","5","2026-06-18T07:45:15.553Z","https://play.google.com/store/apps/details?id=com.spotify.music&reviewId=bc9cc9eb-ea43-4ecd-b723-dac6306a6593"
"playstore","Free version= Dustbin","1","2026-06-18T07:42:27.824Z","https://play.google.com/store/apps/details?id=com.spotify.music&reviewId=fa4e63d4-1caf-404f-ad9c-3eb62acd6587"
"playstore","I love this app, it always provide new songs. 5 star for spotify","5","2026-06-18T07:40:40.357Z","https://play.google.com/store/apps/details?id=com.spotify.music&reviewId=95fab21d-c5f9-4ae3-b95a-58cf016c010b"
"playstore","not bad💯 ads though 👀","5","2026-06-18T07:39:53.558Z","https://play.google.com/store/apps/details?id=com.spotify.music&reviewId=7a23ff44-1513-4711-bb4f-9866313f9322"
"playstore","I love this app it's just that u will need to pay to listen to the songs u want. it will only happen if you play Spotify for awhile","4","2026-06-18T07:37:08.285Z","https://play.google.com/store/apps/details?id=com.spotify.music&reviewId=73f17367-42e5-46ee-846c-262cde71e4c6"
"playstore","toooooo muchhhh adddddd","1","2026-06-18T07:36:11.928Z","https://play.google.com/store/apps/details?id=com.spotify.music&reviewId=59445788-80c6-4d40-97ca-ebe00ad4a86b"
"playstore","Brings so much happiness. Thank you.","5","2026-06-18T07:35:34.982Z","https://play.google.com/store/apps/details?id=com.spotify.music&reviewId=9e2a24a9-536f-4208-96ee-df75a6a151dd"
"playstore","why tf did y'all take of free mobility of us listening to songs","2","2026-06-18T07:31:22.264Z","https://play.google.com/store/apps/details?id=com.spotify.music&reviewId=09955d32-9dbf-45a4-a222-f5d9a7b386af"
"playstore","when I listen songs so song doesn't start play instead ads come after every singel song so disgusting 🙂","1","2026-06-18T07:29:41.717Z","https://play.google.com/store/apps/details?id=com.spotify.music&reviewId=3806e4db-a759-4d4e-943f-4de62b83fd4b"
"playstore","I love this app before yt music I love Spotify cuz it's song can stay if we remove the tab or smth🥰🥰 But pls remove premium pls🥰🥰🙏🏻","3","2026-06-18T07:28:33.340Z","https://play.google.com/store/apps/details?id=com.spotify.music&reviewId=9ae65036-089a-4036-b459-a626049adcdb"
"playstore","una feel say person dey pluck money from tree bah?? I pay for premium, I was debited on the 2nd of June or so. At just June 15th or there about, una dey talk say payment failed, like una wan debit me again?? I decided to just cancel the subscription. Normally, if you cancel subscription, you'll be able to use it for the rest of the month but noooooo. As I cancelled the subscription, una nor waste time, una jejely kick me out. Make una sufree oh 😠😠","1","2026-06-18T07:26:00.176Z","https://play.google.com/store/apps/details?id=com.spotify.music&reviewId=7d677ed1-ceff-4081-b5b6-784bb4bace49"
"playstore","since i knew this app i dont have to worri about not knowing the titel of a paticuler song i come acros","5","2026-06-18T07:24:42.294Z","https://play.google.com/store/apps/details?id=com.spotify.music&reviewId=9427eef7-f8a8-4f29-8da0-6ef4ef1747bd"
"playstore","Premium Plan is affordable and Worth purchasing if you don't want ads and limitations.","4","2026-06-18T07:24:21.346Z","https://play.google.com/store/apps/details?id=com.spotify.music&reviewId=fc324ac7-697c-475c-b50a-b529d4d3d03e"
"playstore","the app is right to hear music but the music app is installing slowly I don't want too many verifications I just want to touch the app and have to hear music identify creations and so many so I don't want any verification that and this","3","2026-06-18T07:24:08.495Z","https://play.google.com/store/apps/details?id=com.spotify.music&reviewId=01c8a7ef-f84a-4ee9-8932-2ebca35d52ee"
"playstore","Mast hai yaar Maja aa jata is app par song sun kar aur sab Mast bhot badhiya hai","5","2026-06-18T07:22:43.534Z","https://play.google.com/store/apps/details?id=com.spotify.music&reviewId=38b726da-5ab4-493a-a8c6-ec426d6ad26d"
"playstore","Agar har ek cheez pe charge issue karoge to koi bhi isse aap ko use nahi karenge","2","2026-06-18T07:21:59.818Z","https://play.google.com/store/apps/details?id=com.spotify.music&reviewId=76c8956f-f55f-4d35-8762-61f979dc165f"
"playstore","love Spotify but could be annoying some time","5","2026-06-18T07:21:41.700Z","https://play.google.com/store/apps/details?id=com.spotify.music&reviewId=4474ced2-252c-4d8a-b51d-5701e576bc04"
"playstore","wow very nice 🙂","5","2026-06-18T07:18:16.511Z","https://play.google.com/store/apps/details?id=com.spotify.music&reviewId=a8ac6dd4-e07b-4240-af86-5873718cfa0e"
"playstore","very nice Spotify","5","2026-06-18T07:16:15.394Z","https://play.google.com/store/apps/details?id=com.spotify.music&reviewId=e4280e5e-9f9c-491e-a7a3-6284e359f2fa"
"playstore","I don't have premium but I get alot of ads, I get 2-4 adds after one song. I get the same ads over and over. But it's still a great app for listening to music on, there's plenty of podcasts to listen to, you can even make your own playlists and add any song to it! Still an amazing app!","4","2026-06-18T07:14:36.570Z","https://play.google.com/store/apps/details?id=com.spotify.music&reviewId=33d13f78-8b52-4159-b9d9-0a2eddd55e29"
"playstore","Experience is good","5","2026-06-18T07:13:32.737Z","https://play.google.com/store/apps/details?id=com.spotify.music&reviewId=3e1755af-9ac5-4ad9-954d-a6bdb84606b9"
"playstore","...still listening and enjoying 😉","5","2026-06-18T07:10:14.280Z","https://play.google.com/store/apps/details?id=com.spotify.music&reviewId=07cda6ea-4038-4596-b1ab-f2186545a9dc"
"playstore","Would seriously love to give this 4 stars. Sucks when it comes to unpaid sub but the student deal is really good. What I do have a problem with is the new Android widget. Tried taking it up with customer support but even when you ""message a representative"" nothing comes of it. I have a green loading screen of death and half the time when I try using it to get to the app it glitches out on me and takes me out of the app. Give me my old widget back!!!","2","2026-06-18T07:07:18.148Z","https://play.google.com/store/apps/details?id=com.spotify.music&reviewId=32c39ba8-e029-431b-a754-67a0f0c64076"
"playstore","ilike Spotify music","4","2026-06-18T07:05:00.287Z","https://play.google.com/store/apps/details?id=com.spotify.music&reviewId=925b7861-37df-4673-9222-cf897fde743b"
"playstore","Great experience","4","2026-06-18T07:02:39.328Z","https://play.google.com/store/apps/details?id=com.spotify.music&reviewId=ee055405-7313-4f21-aa7e-467ced468cf9"
"playstore","it is a great and efficient kuyanyiwa kule app","5","2026-06-18T07:01:41.990Z","https://play.google.com/store/apps/details?id=com.spotify.music&reviewId=788f2bc2-cb13-43c8-8c2c-fb8d458a7654"
"playstore","clarity is guaranteed","5","2026-06-18T06:59:51.382Z","https://play.google.com/store/apps/details?id=com.spotify.music&reviewId=661c97cb-21d2-4f81-8847-ee2f1352ce11"
"playstore","Absolutely HORRIBLE, what do you mean you have to pay to change songs? Stop being greedy spotify","1","2026-06-18T06:59:48.197Z","https://play.google.com/store/apps/details?id=com.spotify.music&reviewId=14b04ff4-0294-4853-b77e-582d53b7299c"
"playstore","it only sucks if you dont have premium benefits but from my experience this is peak, although there was this song I forgot about that I'll put in later and edit that you guys deleted and im just asking to bring it back because it wasnt rude or anything, it was quite popular and it was my gf favourite song","5","2026-06-18T06:56:30.380Z","https://play.google.com/store/apps/details?id=com.spotify.music&reviewId=35faa455-0585-412c-9132-1a607d16379b"
"playstore","The recommendation system is fire 🔥🔥","5","2026-06-18T06:55:17.272Z","https://play.google.com/store/apps/details?id=com.spotify.music&reviewId=4d03e949-cfaf-4b7b-8640-e9927fd87460"
"playstore","A wonderful app for listening to music but the occasional ads are a bit letdown though and they are increasing becoming frequent....","4","2026-06-18T06:53:44.765Z","https://play.google.com/store/apps/details?id=com.spotify.music&reviewId=70ad424b-c0f6-4dac-b54c-ec6f123f998e"
"playstore","sweet if you can subscribe","5","2026-06-18T06:52:18.574Z","https://play.google.com/store/apps/details?id=com.spotify.music&reviewId=d14ae460-d549-4621-bfa1-6e68d5f909ea"
"playstore","I would have given it five but it gives you random age checks","4","2026-06-18T06:51:16.560Z","https://play.google.com/store/apps/details?id=com.spotify.music&reviewId=5a639be8-6e90-4f1f-a41e-e42c44a1f2bb"
"playstore","best music app but ads😡","4","2026-06-18T06:50:54.407Z","https://play.google.com/store/apps/details?id=com.spotify.music&reviewId=d323a113-5acd-4278-8ffb-d1f043527ad9"
"playstore",">song DNA is gen good. > I genuinely hope this company gets bankrupt so it can get sold to someone who cares about its app functioning. please rich people i call out to u make sure they fail i cant take it anymore.","2","2026-06-18T06:50:15.332Z","https://play.google.com/store/apps/details?id=com.spotify.music&reviewId=1ae07bb8-5c19-48d5-909d-fecbc6f02c36"
"playstore","Why change a running system?? ich hatte Jahre lang Spotify als 3x1 widget, es hat genau zwischen die anderen Apps auf meinen Homescreen gepasst. Was soll das, dass es jetzt mehr Platz braucht? Wie arrogant.","3","2026-06-18T06:47:16.807Z","https://play.google.com/store/apps/details?id=com.spotify.music&reviewId=48e3cb06-6df0-4f31-8a5f-d258dc6fc029"
"playstore","perfect aap for all music moods. MUST HAVE .","5","2026-06-18T06:46:13.224Z","https://play.google.com/store/apps/details?id=com.spotify.music&reviewId=7add827d-611e-4897-af0d-475467cc4190"
"playstore","Terrible for podcasts. Queues are flat out broken.you play episode 60 and it will add random episodes into the queue. then there is the AI slop, every playlist is full of it. Spotify hate artists.","1","2026-06-18T06:44:36.200Z","https://play.google.com/store/apps/details?id=com.spotify.music&reviewId=f2f4163e-b6c3-4302-a489-73475457d0a8"
"playstore","Spotify is an amazing app that I use every single day, all of it's features especially DJ are soo good. I love Spotify.","5","2026-06-18T06:44:00.353Z","https://play.google.com/store/apps/details?id=com.spotify.music&reviewId=64079ff9-27f1-42c9-8bb6-45332fa91d48"
"playstore","literally barely works off wifi anymore. horrible app. widgets are useless and inoperable","1","2026-06-18T06:39:13.328Z","https://play.google.com/store/apps/details?id=com.spotify.music&reviewId=0b80624c-68dd-4894-bb80-fddeac87d480"
"playstore","یعنی چی که پرمیوم نداشته باشی فقط میتونی پنج تا اهنگ در روز گوش بدی؟ جمع کنید بابا","1","2026-06-18T06:37:39.754Z","https://play.google.com/store/apps/details?id=com.spotify.music&reviewId=ae2fa6c1-bca3-4644-9988-35728028b51b"
"playstore","nice app just too many ads 😞","5","2026-06-18T06:35:54.547Z","https://play.google.com/store/apps/details?id=com.spotify.music&reviewId=09b0922e-b641-450b-97c4-3f86a6ea48a6"
"playstore","so many ads in app for buy subscription","1","2026-06-18T06:35:27.542Z","https://play.google.com/store/apps/details?id=com.spotify.music&reviewId=3ab8d677-132f-457a-bda0-1070aa635624"
"playstore","App keeps failing to start, I've reinstalled and it fixes the issue but it's every 3 days at this point, starting to really grate on me as subscription price only goes up and so do the myriad of issues within the app. Surely more money means more staff to fix issues across devices","1","2026-06-18T06:35:19.434Z","https://play.google.com/store/apps/details?id=com.spotify.music&reviewId=6e46ee26-a713-466d-b98d-597ee6498d93"
"playstore","I love song and k-pop It helps me so much to listen to my fav songs and this app is very nice I love it.form Tysm Spotify <3😱","5","2026-06-18T06:32:42.804Z","https://play.google.com/store/apps/details?id=com.spotify.music&reviewId=cadc67a2-51be-43e9-9dde-022f1582e765"
