source,text,rating,date,url
"reddit","She seems to only accept those proofs of spiritual reality that have been *empirically proven* through **these children**  This is simply not true. It is omitting Episode 6, which contains the scientifically-rigorous peer-reviewed research into spirituality/consciousness   >[Ep 6: Scientific Evidence](https://open.spotify.com/episode/441DSFv5uKBNp3RrQKtrGY?si=8_uWVCmmR7KlP9WA0AshAw) > >In this highly anticipated science episode, we explore the rich history of telepathy research in both humans and animals, uncovering groundbreaking studies that challenge the materialist worldview. Leading scientists suggest that consciousness, not matter, may be the fundamental building block of the universe—offering a powerful explanation for telepathy and other unexplained phenomena. > >We hear from Dr. Diane Hennessey Powell, whose work on telepathy in non-speakers has spanned over a decade, and from Dr. Rupert Sheldrake, a Cambridge biologist whose career was transformed after learning about a blind boy who could seemingly “see” through his mother’s eyes. This discovery led Dr. Sheldrake to study telepathy, particularly in animals, revealing the profound bonds between pets and their owners. Dr. Dean Radin, Chief Scientist at the Institute of Noetic Science, guides us through the history of telepathy research, including the pivotal Ganzfeld studies, which provided strong evidence for the existence of telepathy over the past several decades. > >The episode introduces groundbreaking ideas about a new scientific paradigm, where consciousness is viewed as the most fundamental building block of the universe. This shift in thinking could explain many psi phenomena, like telepathy, that the materialist worldview has struggled to account for. By exploring quantum physics, we learn that particles can be connected over great distances, influencing each other instantly—an idea that echoes the potential for human minds to be similarly entangled across space and time. Dr. Marjorie Woollacott, the President of the Academy for the Advancement of Postmaterialist Sciences, also shares how her research supports the idea that consciousness may not be confined to the brain, but rather a pervasive force in the universe. > >We also revisit Dr. Sheldrake’s research on telepathic connections between animals and their human companions, including an that demonstrated extraordinary telepathic abilities. These examples push the boundaries of conventional science and open the door to a deeper understanding of consciousness and its role in shaping our reality. > >As the episode draws to a close, we discuss the limitations of the materialist paradigm and explore alternative theories of consciousness, setting the stage for the next episode, which promises to dive deeper into the remarkable abilities of non-speaking individuals.","","2025-05-19T00:50:08.000Z","https://reddit.com/r/TheTelepathyTapes/comments/1kpvpgp/concern_about_telepathy_tapes_presentation_of/mt1odcj/"
"reddit","I use the free tiers of Spotify or Youtube Music. I imported my playlists to those services to tune the algorithms and the discovery features on those services definitely help cast a wider net.","","2025-05-18T23:32:08.000Z","https://reddit.com/r/AppleMusic/comments/1kozq5u/whats_your_recommendation_for_finding_more_songs/mt1bskp/"
"reddit","Ugh thanks for reminding me. I had forgotten about that shit show.  Everyone was freely using whatever app they wanted to pull podcasts from whatever service and Spotify decides to reinvent podcasting by becoming a podcast ""platform"". Nobody wanted a platform for podcasting and it was not needed so they dumped all of the money in the world to make it an exclusive thing, fractioning the entire thing and making it worse for everyone.  Bafflingly they pushed it HARD into the existing users by ruining search, recommended, discovery etc. with random podcast episodes appearing everywhere. ""You searched for Techno? Here is a 75 minute episode nr 34 of of a Technology podcast you never heard of! Listen to this shit while working out"". I think that was when I started to look into Spotify and then eventually quit paying for it","","2025-05-18T22:16:49.000Z","https://reddit.com/r/assholedesign/comments/1kpm492/spotify_put_their_new_useless_ai_feature_right/mt0za37/"
"reddit","besides the poor sound quality, the other guy mentioned, spotify is not truthful and not honest around how they drive music discovery and i don't think at all they're a neutral arbiter in regards to discovery, ie they push the scale towards artists of their own choosing and at the cost of others  additionally, they absolutely do not have access to almost every song made - they're missing huge catalogs especially of music from outside the US","","2025-05-18T21:50:23.000Z","https://reddit.com/r/edmproduction/comments/1kpjbgr/do_you_guys_actually_like_streaming_services/mt0umo2/"
"reddit","Honestly I just want my library to be my home screen.  I want all the discovery aspects seperate to the music ive already saved.  Im sick of opening spotify & having a million things pushed on me.   I love spotify but it’s just not as good as it was idk","","2025-05-18T21:24:01.000Z","https://reddit.com/r/truespotify/comments/1kpemc3/how_many_more_stupid_updates_until_the_app_is/mt0pv2z/"
"reddit","Best for playback: podcast republic. Best for podcast discovery/recommendations: Spotify","","2025-05-18T21:06:18.000Z","https://reddit.com/r/androidapps/comments/1kpmmvu/podcast_app_recommendations_please/mt0mld5/"
"reddit","This is a great opportunity to move away from spotify and better support the artists you love by buying their music on Bandcamp or other platforms. For music discovery I listen to KEXP which streams free online, if you have a local independent radio station that's a great place to look too!","","2025-05-18T17:45:34.000Z","https://reddit.com/r/dumbphones/comments/1kpn55t/music_lovers_how_do_you_do_it/mszkujs/"
"reddit","I recently subbed to Apple Music while I’m still subbed to Spotify and will continue both. The music discovery on Spotify is what keeps me hooked due to being able to find great new artists with ease with all of the curated playlists and AI DJ has given me some good recommendations. That being said, the audio quality difference is more insane than I thought. Apple Music’s fidelity is miles ahead of Spotify. Also a weird thing I noticed that I totally wouldn’t put passed Apple, if you use the spatialize audio feature with head tracking on stereo tracks on Spotify, they end up sounding thin and almost out of phase, but the Spatial Audio feature sounds amazing on everything on Apple Music","","2025-05-18T13:34:12.000Z","https://reddit.com/r/AppleMusic/comments/1kou8vb/innovation_difference_between_am_and_spotify/msya4dz/"
"reddit","Honestly, I’ve used both a lot, and I think Spotify’s algorithm is just way better at finding niche stuff. YouTube Music is decent, but it feels more like it’s guessing based on general YouTube habits, not actual music taste. With Spotify, I’ve discovered way more underground artists through playlists like ‘Alternative Hip Hop’ or song radios..it just knows the vibe I’m into. I get why some people say YT Music has a good algorithm, but for real music discovery, Spotify wins for me..","","2025-05-18T13:14:05.000Z","https://reddit.com/r/truespotify/comments/1kpb9et/why_do_people_say_youtube_music_have_way_better/msy6ymq/"
"reddit","i would consider going back to spotify if they offer lossless but no, you don't get that option and to think that they charge higher for less is such as scam and no, i also don't listen to shit that was fed to me by some discovery algorithms. I will be listening to what i want and when i want it. i know my music","","2025-05-18T08:39:16.000Z","https://reddit.com/r/AppleMusic/comments/1kou8vb/innovation_difference_between_am_and_spotify/msxbrd1/"
"reddit","For music discovery, most major streaming apps let you start with a track and then follow up with others in a similar theme. But platforms like Spotify often guide you gently back toward the mainstream, even when you begin off the beaten path.   If you want to avoid that and find more distinctive music, consider using SoundCloud (based in Germany), which tends to surface more underground, regional, or experimental tracks — and also pays its artists far better.   You can also explore manually using a genre/country map like EveryNoise.com  which lets you search by genre, by region, or even start from an artist and branch out via similar.   Having said that, the song you picked is by Rodrigo Amarante (Brazilian, based in the US), and if you like that cinematic, atmospheric feel, you might really enjoy Hermanos Gutiérrez (two brothers, Swiss/Ecuadorian). Their music sounds like a desert road movie — intimate, hypnotic, and full of space.","","2025-05-18T08:03:54.000Z","https://reddit.com/r/BuyFromEU/comments/1koqn2o/non_usuk_music_and_songs_suggestions/msx8f3k/"
"reddit","I continue to use Spotify, Apple Music and YouTube Music - all paid plans simultaneously - since a few years, and I’ve found Apple’s music audio quality to be the best. YTM’s UI and response is snappier than the other 2. Apple’s search is a bit laggy and needs precise inputs, but doesn’t bother me that much on a daily basis.  In terms of simple recommendations- whether you call it a station or a radio or AI DJ or whatever, I have personally had equally good suggestions from all 3 over the years for my tracks and playlists. Neither has actually ever disappointed. All 3 algorithms have given me amazing music discovery.  In terms of fresh music discovery, I feel YTM is doing a great job on their home page + swiping shorts feature, etc.","","2025-05-18T07:56:22.000Z","https://reddit.com/r/AppleMusic/comments/1kou8vb/innovation_difference_between_am_and_spotify/msx7osy/"
"reddit","2 recommendations for you:    1. Discover the power of paragraphs - I confess I couldn’t read your post  -  so I hope my next comment is on topic.   2.  Let an algorithm lead you from one thing to another Eg Spotify or ask ChatGPT. You’ll make amazing discoveries. Just skip past anything that doesn’t appeal to you.","","2025-05-18T06:54:28.000Z","https://reddit.com/r/Jazz/comments/1kp6aav/want_to_get_into_jazz_but_rather_ease_into_it_in/msx1p9n/"
"reddit","I don't have one favorite, but one f my favorite recent discoveries is Full Nothing's whole discography. You can try their first (self titled) or second ""Somewhere and Nowhere"" album for starters.  I generally like progressive albums (while I usually prefer to listen to single songs), you can find above and some more of my favorites on [this playlist](https://open.spotify.com/playlist/78g7rb1P0EjvYgaUkvNsYW?si=c88e561277544cb8).","","2025-05-18T06:12:18.000Z","https://reddit.com/r/MusicRecommendations/comments/1kp806y/i_want_to_listen_to_an_album_out_of_my_confort/mswxiv7/"
"reddit","The only reason I haven’t moved away from Plexamp is because of the sonic analysis. Thanks OP. This is great work and gets me closer to ditching plex completely. I use plex only for music and if this works well I might completely move to this.  I wanted to throw this out. Not sure if folks are interested. If there’s a way to anonymously sync or maintain a database of sonic analysis data from essentia, I can help develop a ML/AI algorithm to provide new song suggestions based on sonic metadata. This would require community willingness for folks to anonymously share their sonic analysis data for songs in their library. If we have this then we can recommend new music based on users listening patterns. Kinda like how Netflix recommends movies to users.   If there’s interest in this and it’s feasible to implement a centralized system for collecting sonic metadata I can help build this. I’m more than happy to explain how this will work if folks are skeptical about privacy. I want to emphasize that it’s completely possible to do this without leaking any sensitive data.   Adding this will enable a music discovery feature similar to Spotify.","","2025-05-18T04:33:14.000Z","https://reddit.com/r/selfhosted/comments/1kny59f/updates_to_jellify_a_cross_platform_music_app_for/mswmpc3/"
"reddit","Instead of thinking about this as the redebut groups failing to keep up with Loona, consider that those Loona streaming numbers reflect the enduring quality of Loona’s music.  Spotify discovery numbers are largely driven by playlists, so that’s how Loona still has so many monthly streams despite the boycott.","","2025-05-18T03:33:46.000Z","https://reddit.com/r/kpop_uncensored/comments/1kpa852/why_arent_postloona_groups_doing_as_well_as_before/mswfakt/"
"reddit","You are doing excellent and I am so happy for you. Congratulations on your 2,000 views! Now let's see what other moves we can make in order to reach more audience:  START A CLIPPING CHANNEL! There are more than 50+ million viewers who engage with YT Shorts so you get the point. Create many 30-40 sec long time stamps on your podcast and add SFX, Texts and music to make it engaging and upload them to a different channel.   You said you cover a large wide topic, initially this is exactly what you should do but after 100 to 150 contents, eliminate 90% of the topics and stick to the ones that have statistically gotten your views. You do not need large equipments, just hire a color grader and sound designer for your podcast. You need to be able to deliver high quality content, not just the topics. Facebook group is a strong tool, explore other platforms too such as discord, IG, REDDIT any where your audience hangs out.  Overall  Consistency is the key Work with the right people, your channel is in its baby steps so your channel needs the professional touch. Either you learn it, or you hire. I suggest you learn vocal processing and stuff. Good Distribution = Good Discovery, use other platforms such as Spotify and upload your contents there too.  Hope this helps. Let me know if you have any follow ups","","2025-05-18T01:46:33.000Z","https://reddit.com/r/podcasting/comments/1kp8hf4/im_a_content_specialist_helping_youtubers_to_get/msw0b8t/"
"reddit","Quite the idea of getting the audience out of existing platforms to your own. This is a war that huge players like meta, Google or Amazon are playing, don't go there. They have people's attention and they will sell it to you with adds or you you can ""work for them"" by creating content that keeps people using their services, this is what people do when they reach amounts of people and think they are ""hacking the algorithm"" they are just rewarded by the platform for doing good unpaid work lol. Where your idea is still good is that since short form is the discovery way, it enables you to drive traction and give access to full songs later. But people who pay for that will still want to listen to the song via their current tool (Spotify, YT music or else...) If you manage to technically build a funnel that drives people smoothly from discovering a track on tik tok to paying their access to the full song and then to play it on whatever streaming platform they are using, then you might hold a big thing that will be bought by apple or so in few years. But please don't overlook the listener's experience, they are the core of this whole battle.","","2025-05-18T00:58:40.000Z","https://reddit.com/r/musicmarketing/comments/1kp5m13/update_the_infrastucture_of_the_music_industry_is/msvt9cf/"
"reddit","There are so many features and corners of the old beinternet I still quietly mourn:  Google Reader – the undisputed king. No ads, no algorithm, just clean RSS feeds and total control over your content. It felt like your internet, not what a platform wanted you to see.  Forums – before everything got centralized, niche forums were thriving communities. Slow-paced, thoughtful, and weird in the best way. You weren’t chasing likes—you were just part of a tribe.  Yahoo Answers – chaotic, hilarious, sometimes genuinely helpful. The unfiltered energy there was unmatched.  Del.icio.us – tagging and organizing bookmarks across the web, publicly. It felt like the internet was something you could curate, not just consume.  The “Random” button on StumbleUpon – genuinely serendipitous. You’d find indie games, weird art, forgotten blogs, stuff no algorithm would ever recommend today.  Neopets / Gaia Online / early virtual worlds – not just games, but places where people hung out. No monetization pressure, just endless customization and goofy fun.  Pre-YouTube embedded Flash sites – people built entire interactive experiences just for fun. Sites like Homestar Runner or those old-school Flash games were internet playgrounds.  Fan-made Geocities/Angelfire pages – horribly designed, but so full of personality. Every page was a labor of love.  Away messages on AIM – mini blogs before microblogging. You could lowkey talk about your feelings or throw shade and your friends would get it.  Pre-Spotify MP3 blogs – people uploading rare tracks, remixes, and mixtapes they curated themselves. Music discovery felt personal, not dictated by algorithms.  The “Old YouTube” – before monetization became the whole game. People made weird, funny, unpolished stuff just for the joy of it.  When websites had guestbooks – yeah, like “sign my guestbook!” The early social proof.   What I really miss is the vibe. It was slower, less optimized, and way more experimental. No one was chasing engagement or trying to go viral. You built stuff for fun, for a niche, or just to share with friends. It felt like exploring a digital forest—now it feels like we’re all stuck in the same shopping mall.","","2025-05-17T22:21:58.000Z","https://reddit.com/r/AskReddit/comments/1koz7pi/whats_a_dead_feature_of_the_internet_you_still/msv4cep/"
"reddit","The first difference is that my platform is dedicated specifically to music. While other short-form platforms are good for music discovery, they are not built for music discovery, meaning that there is a lot of room for improvement. There seems to be [significant demand ](https://www.tiktok.com/@st4r.stranded/video/7449831050164882710)for a dedicated music discovery platform like this, as platforms like TikTok are good but not great.  There is also the advantage of not needing to make content. I, and I'm sure a lot of other musicians, find content creation pretty annoying and tedious. This platform allows artists to grow organically without needing to create content. I would imagine that the removal of the content barrier may also mean that there is better music on the platform.  Lastly, while short-form music has become ubiquitous, there is no dedicated short-form music hub. Spotify is really useful because it organizes the absurd amount of music that currently exists. The only issue is that it isn't really made for short-form music, which has its own unique use cases. The current short-form music hub is TikTok, and much like it's use for music discovery, it is good but not great at this. The goal of this platform is to create a centralized hub for short-form music that can facilitate all of the unique use cases of short-form music (discovery, use in short-form video, background listening, competition, communication, etc.)  Really good question. I hope this is a satisfying answer.","","2025-05-17T21:28:20.000Z","https://reddit.com/r/musicians/comments/1kp2zw9/the_growing_importance_of_shortform_music_means/msuvb4n/"
"reddit","Lol a lot of the other arguments say that Spotify is better for discovery than SoundCloud.   What strengths do you think SoundCloud has in discovery?","","2025-05-17T19:47:40.000Z","https://reddit.com/r/musicindustry/comments/1kndbub/how_is_spotify_more_successful_than_soundcloud/msud4ub/"
"reddit","Apple is about listening to the same music repeatedly (playlist). So Spotify is about new music discovery.","","2025-05-17T19:40:28.000Z","https://reddit.com/r/AppleMusic/comments/1knqnls/apple_looks_to_poach_spotify_users_with_new/msubu3v/"
"reddit","spotify’s cleaner, more mainstream, and pays better. it’s where most fans are, and it pushes music through playlists and algorithms. soundcloud’s great for discovery, but spotify’s built for mass listening.","","2025-05-17T18:29:54.000Z","https://reddit.com/r/musicindustry/comments/1kndbub/how_is_spotify_more_successful_than_soundcloud/mstzbzh/"
"reddit","Your experience is completely opposite to mine. Spotify rules in his ability to help with music discovery, and I find Apple to be by far the worst.","","2025-05-17T17:47:50.000Z","https://reddit.com/r/AppleMusic/comments/1kowrwn/apple_music_playlists_have_a_more_human_touch/mstrn1j/"
"reddit","I have normal hearing so can’t tell a difference in the audio. I’ll take the better UI and playlist discovery of Spotify.","","2025-05-17T17:15:49.000Z","https://reddit.com/r/AppleMusic/comments/1kou8vb/innovation_difference_between_am_and_spotify/mstlhy9/"
"reddit","[https://open.spotify.com/track/2ltpz0N6g4A7TwwLFk9biF?si=xCjTDw9ASlCXM0tar-97FA](https://open.spotify.com/track/2ltpz0N6g4A7TwwLFk9biF?si=xCjTDw9ASlCXM0tar-97FA)  Heard this song like 70 times since discovery. ![img](emote|t5_2qp7h|59842)","","2025-05-17T16:53:57.000Z","https://reddit.com/r/indiasocial/comments/1kovozm/late_night_random_discussion_thread_17_may_2025/mstheh7/"
"reddit","Spotify. Easy music discovery.","","2025-05-17T16:51:35.000Z","https://reddit.com/r/AskReddit/comments/1kor2qt/what_online_subscription_app_that_you_use_daily/mstgydq/"
"reddit","Spotify's discovery features are way better in my experience.","","2025-05-17T14:15:48.000Z","https://reddit.com/r/The10thDentist/comments/1kok2od/youtube_music_is_infinitely_superior_to_spotify/mssoeqz/"
"reddit","My record collection started with my dad’s records. Mostly rock like Zeppelin, Floyd, Grand Funk Railroad, Styx, etc. But there was some doo wop and soul mixed in as well, which I totally love now. I think more so than any particular artist or genre though, I’m just glad music was a huge part of my childhood with a lot of variety. My mom has a pretty good voice and is really into the 50s tunes and sang them all the time. Some days it was classical music playing, and by October it was Christmas music 🤣 I hope to bring that to my kids. We now have a large record collection, turntables in all their rooms, a DJ setup for spinning in the basement and a turntable and 8-track player in the living room. We all have Spotify for discovery and I think it’s working. One kid in an elite competitive show choir and the other playing percussion in the band. Plus they’re constantly listening to new music. Whether or not they’ll ever appreciate my music tastes fully, I know deep down inside it’s in there.","","2025-05-17T13:45:51.000Z","https://reddit.com/r/LetsTalkMusic/comments/1koovcy/anyone_elses_dad_introduce_them_to_some_good_old/mssjg7d/"
"reddit","I'm glad you liked it :).  I'd be totally fine with AAC becoming the new ""standard,"" though I wonder how much the masses care at this point since it seems that streaming is now the primary medium for listening to music. Ultimately, I just want to see MP3 stop being so standard. It's a great format that absolutely served its purpose, but it's been surpassed now.  I mostly listen to local media on my setup at home and use streaming more for music discovery. I have Spotify largely because it's what my friends use and I can see what they're listening to. At work, my team has a Tidal account so I often use that when I'm on my work system, whether I'm actually working or not lol.","","2025-05-17T13:41:36.000Z","https://reddit.com/r/headphones/comments/1koipqo/dear_wannabe_audiophiles_on_hires_audio/mssirxr/"
"reddit","Feature wise YTM doesn't really have one to beat Spotify. You would loose things like crossfade, Spotify Connect, and some specific features.  But overall, the experience is much less irritating than Spotify for me. I listen to a lot of video game OSTs which usually are not on Spotify immediately so for me it's great to have on YTM.  Queueing on Spotify makes no sense to me, add to queue is just ""play next"" by creating a custom queue in the middle of the existing queue? I don't get it, and YTM's simple ""play next"" and ""add to queue"" is much simpler.  Song discovery is much better on YTM which isn't that big of a surprise considering it just uses YouTube's recommendation algorithm, and playing a song radio gives you more options than Spotify to play familiar or newer or popular songs, though sometimes it can be a hit and miss imo.  Finally, it has way less obsession with playing videos if you choose the settings to play audio only, meanwhile Spotify plays some random video loop everytime I play a song.","","2025-05-17T12:07:57.000Z","https://reddit.com/r/YoutubeMusic/comments/1ko8pgf/thinking_of_switching_to_youtube_music_from/mss55ts/"
"reddit","Spotify will always be a non starter for me. I don’t align with their business practices. Qobuz discovery works very well for me. Kept me perfectly entertained for a 10 hour car ride.","","2025-05-17T11:49:52.000Z","https://reddit.com/r/qobuz/comments/1knfrtt/im_pensive_about_keeping_qobuz_or_not/mss2tum/"
